{
  "schema_version": "0.1.0",
  "observation_id": "OBS-0001",
  "track_id": "TRACK-0091",
  "timestamp": "2026-07-27T18:59:30Z",
  "sensor": {
    "sensor_id": "RADAR-SITE-A",
    "sensor_type": "radar"
  },
  "data_source": "PROTOTYPE_SENSOR_NETWORK",
  "coordinate_frame": "ECI",
  "position_km": [6628.1, 1045.2, -421.7],
  "velocity_km_s": [-1.08, 7.31, 1.42],
  "measurement_quality": 0.87,
  "radar_cross_section_m2": 2.4,
  "estimated_size_m": 1.8
}
